,Medal,Beer Name,Brewery,City,State,Category,Year
0,Gold,A Creator's Calling,The Lost Abbey,San Marcos,CA,Aged Beer,2019
1,Silver,Belgian Quad,Green Mountain Beer Co.,Lakewood,CO,Aged Beer,2019
2,Bronze,Mob Barley,Meadowlark Brewing,Sidney,MT,Aged Beer,2019
3,Gold,Wit-Tington,Central District Brewing,Austin,TX,American-Belgo-Style Ale,2019
4,Silver,Tank 7 Farmhouse Ale,Boulevard Brewing Co.,Kansas City,MO,American-Belgo-Style Ale,2019
5,Bronze,White Rainbow,Red Rock Brewery - Production,Salt Lake City,UT,American-Belgo-Style Ale,2019
6,Gold,Märzen,Sudwerk Brewing Co.,Davis,CA,American-Style Amber Lager,2019
7,Silver,Oktoberfest,Huss Brewing Co.,Tempe,AZ,American-Style Amber Lager,2019
8,Bronze,Grist Maerzen,Grist Brewing Co.,Highlands Ranch,CO,American-Style Amber Lager,2019
9,Gold,Diablo Rojo,Boneyard Beer,Bend,OR,American-Style Amber/Red Ale,2019
10,Silver,1890 Founder's Ale,Grayton Beer Co.,Santa Rosa Beach,FL,American-Style Amber/Red Ale,2019
11,Bronze,Red Alert,Aftershock Brewing Co.,Temecula,CA,American-Style Amber/Red Ale,2019
12,Gold,Alpha Force Double Tap,Überbrew,Billings,MT,American-Style Black Ale,2019
13,Silver,Bowie Knife,Thunderhawk Alements,San Diego,CA,American-Style Black Ale,2019
14,Bronze,Turmoil,Barley Brown's Beer,Baker City,OR,American-Style Black Ale,2019
15,Gold,Naked Sunbather,Mad Swede Brewing Co.,Boise,ID,American-Style Brown Ale,2019
16,Silver,Bull Creek Brown Ale,Springfield Brewing Co.,Springfield,MO,American-Style Brown Ale,2019
17,Bronze,Browner Than Ivan,Chula Vista Brewery,Chula Vista,CA,American-Style Brown Ale,2019
18,Gold,Sea Señor! Mex Lager,SouthNorte Beer Co.,San Diego,CA,American-Style Cream Ale,2019
19,Silver,Los Dudes’ Cerveza Lager Mexicana,The Dudes' Brewing Co.,Torrance,CA,American-Style Cream Ale,2019
20,Bronze,Gold Style,Ballast Point Brewing Co. - Chicago,Chicago,IL,American-Style Cream Ale,2019
21,Gold,Salt River,Historic Brewing Co.,Flagstaff,AZ,American-Style Fruit Beer,2019
22,Silver,Quat,Tampa Bay Brewing Co. - Ybor City,Tampa,FL,American-Style Fruit Beer,2019
23,Bronze,Boom Dynamite,O.H.S.O. Brewery + Distillery,Phoenix,AZ,American-Style Fruit Beer,2019
24,Gold,More Dodge Less RAM,Comrade Brewing Co.,Denver,CO,American-Style India Pale Ale,2019
25,Silver,Radiant Beauty,Green Cheek Beer Co.,Orange,CA,American-Style India Pale Ale,2019
26,Bronze,Weekend Vibes IPA,Coronado Brewing Co. - Production Facility,San Diego,CA,American-Style India Pale Ale,2019
27,Gold,Lite Thinking,Pollyanna Brewing Co.,Lemont,IL,American-Style Lager or American-Style Pilsener,2019
28,Silver,Valley Beer,Wren House Brewing Co.,Phoenix,AZ,American-Style Lager or American-Style Pilsener,2019
29,Bronze,Schaben's,Thunderhead Brewing Co.,Kearney,NE,American-Style Lager or American-Style Pilsener,2019
30,Gold,Johnny Utah,Georgetown Brewing Co.,Seattle,WA,American-Style Pale Ale,2019
31,Silver,Acclimated APA,La Cumbre Brewing Co.,Albuquerque,NM,American-Style Pale Ale,2019
32,Bronze,Breakside Woodlawn Pale Ale,Breakside Brewery,Portland,OR,American-Style Pale Ale,2019
33,Gold,Low pHunk,MobCraft Beer,Milwaukee,WI,American-Style Sour Ale,2019
34,Silver,Alegria,Millersburg Brewing,Millersburg,OH,American-Style Sour Ale,2019
35,Bronze,Citra Acid Test,Triple C Brewing,Charlotte,NC,American-Style Sour Ale,2019
36,Gold,Black Cliffs,Boise Brewing,Boise,ID,American-Style Stout,2019
37,Silver,Stone Liberty Station Cimmerian Portal,Stone Brewing World Bistro & Gardens - Liberty Station,San Diego,CA,American-Style Stout,2019
38,Bronze,Kilgore,Beachwood BBQ & Brewing,Long Beach,CA,American-Style Stout,2019
39,Gold,Superpower IPA,Comrade Brewing Co.,Denver,CO,American-Style Strong Pale Ale,2019
40,Silver,NoPac IPA,Crossbuck Brewing,Walla Walla,WA,American-Style Strong Pale Ale,2019
41,Bronze,JAF IPA,JAFB Wooster Brewery,Wooster,OH,American-Style Strong Pale Ale,2019
42,Silver,Cumberland Punch,East Nashville Beer Works,Nashville,TN,American-Style Wheat Beer,2019
43,Bronze,Termes Beer,Spearfish Brewing Co.,Spearfish,SD,American-Style Wheat Beer,2019
44,Gold,Australian For Pale,Green Cheek Beer Co.,Orange,CA,Australian-Style Pale Ale,2019
45,Silver,Mountain Standard IPA,Odell Brewing Co.,Fort Collins,CO,Australian-Style Pale Ale,2019
46,Bronze,Pete's Stash,Vail Brewing Co. - Vail Village Pilot,Vail,CO,Australian-Style Pale Ale,2019
47,Gold,Snap Yo' Baltics,Freetail Brewing Co. - Brewpub,San Antonio,TX,Baltic-Style Porter,2019
48,Silver,Dark Reckoning,Morgan Territory Brewing,Tracy,CA,Baltic-Style Porter,2019
49,Bronze,Murder Ballads,Noble Beast Brewing Co.,Cleveland,OH,Baltic-Style Porter,2019
50,Gold,Old Diablo,Morgan Territory Brewing,Tracy,CA,Barley Wine-Style Ale,2019
51,Silver,Freebooter Barleywine,Coronado Brewing Co.,Coronado,CA,Barley Wine-Style Ale,2019
52,Bronze,Three Ryes Men,Reuben's Brews - The Taproom,Seattle,WA,Barley Wine-Style Ale,2019
53,Gold,Junebug,Echo Brewing Co.,Erie,CO,Belgian- and French-Style Ale,2019
54,Silver,Swingin' Single,Piece Brewery,Chicago,IL,Belgian- and French-Style Ale,2019
55,Bronze,Industrial Gris,Resident Brewing Co.,San Diego,CA,Belgian- and French-Style Ale,2019
56,Gold,Nènette,Kern River Brewing Co. - The Backyard,Kernville,CA,Belgian-Style Blonde Ale or Pale Ale,2019
57,Silver,Hell's Keep,Squatters Craft Beers,Salt Lake City,UT,Belgian-Style Blonde Ale or Pale Ale,2019
58,Bronze,Suddenly a Saint,Moonraker Brewing Co.,Auburn,CA,Belgian-Style Blonde Ale or Pale Ale,2019
59,Gold,Quad Damn It,Chicago Brewing Co. - Las Vegas,Las Vegas,NV,Belgian-Style Dark Strong Ale or Belgian-Style Quadrupel,2019
60,Silver,Séréneté Grand Cru,Bruz Beers,Denver,CO,Belgian-Style Dark Strong Ale or Belgian-Style Quadrupel,2019
61,Bronze,Sisters Quad,Bitter Sisters Brewing Co.,Addison,TX,Belgian-Style Dark Strong Ale or Belgian-Style Quadrupel,2019
62,Gold,Dedication,Vintage Brewing Co. - Madison,Madison,WI,Belgian-Style Dubbel,2019
63,Silver,Belgian Dubbel,Sugar Creek Brewing Co.,Charlotte,NC,Belgian-Style Dubbel,2019
64,Bronze,OB Bubble Dubbel,Kilowatt Brewing,San Diego,CA,Belgian-Style Dubbel,2019
65,Gold,Foxy Lady,Silver City Brewery,Bremerton,WA,Belgian-Style Fruit Beer,2019
66,Silver,All the Goodness,Gezellig Brewing Co.,Newton,IA,Belgian-Style Fruit Beer,2019
67,Bronze,Cherry Valley Farmhouse,Heritage Hill Brewhouse & Kitchen,Pompey,NY,Belgian-Style Fruit Beer,2019
68,Gold,Get The Funk Out,Crooked Stave Artisan Beer Project,Denver,CO,Belgian-Style Lambic or Sour Ale,2019
69,Silver,Olly,Free Will Brewing Co.,Perkasie,PA,Belgian-Style Lambic or Sour Ale,2019
70,Bronze,Saison Apothēca,Yeast of Eden,Carmel-By-The-Sea,CA,Belgian-Style Lambic or Sour Ale,2019
71,Gold,Fu Fighter,Good River Beer,Denver,CO,Belgian-Style Pale Strong Ale,2019
72,Silver,Sandy Dunes Saison,River Bluff Brewing,St. Joseph,MO,Belgian-Style Pale Strong Ale,2019
73,Bronze,Stay Gold,Bluebird Brasserie,Sherman Oaks,CA,Belgian-Style Pale Strong Ale,2019
74,Gold,Princeps Pacis,Save The World Brewing Co.,Marble Falls,TX,Belgian-Style Tripel,2019
75,Silver,Marvella,Red Rock Brewery - Production,Salt Lake City,UT,Belgian-Style Tripel,2019
76,Bronze,Triple-Whirl,217 Brew Works,Wilson,NC,Belgian-Style Tripel,2019
77,Gold,Way West Wit,Zuni Street Brewing Co.,Denver,CO,Belgian-Style Witbier,2019
78,Silver,Boeman Belgian White,Ogopogo Brewing,San Gabriel,CA,Belgian-Style Witbier,2019
79,Bronze,Under a Blood Orange Sky,Temblor Brewing Co.,Bakersfield,CA,Belgian-Style Witbier,2019
80,Gold,Tackle Bock,Bobbing Bobber Brewing Co.,Hutchinson,MN,Bock,2019
81,Silver,Maibock,Dry Dock Brewing Co. - South Dock,Aurora,CO,Bock,2019
82,Bronze,Dunkel Bock,Pilot Brewing Co.,Charlotte,NC,Bock,2019
83,Gold,Bohemian Shine,Castle Island Brewing Co.,Norwood,MA,Bohemian-Style Pilsener,2019
84,Silver,Bo Pils,East Brother Beer Co.,Richmond,CA,Bohemian-Style Pilsener,2019
85,Bronze,The People's Pilsner,Sudwerk Brewing Co.,Davis,CA,Bohemian-Style Pilsener,2019
86,Gold,Who's Brett?,The Hold By Revelry Brewing,Charleston,SC,Brett Beer,2019
87,Silver,St. Eldritch,Cellar Works Brewing Co.,Sarver,PA,Brett Beer,2019
88,Bronze,C'Mon Sunshine,Birds Fly South Ale Project,Greenville,SC,Brett Beer,2019
89,Gold,Maduro Brown Ale,Cigar City Brewing,Tampa,FL,Brown Porter,2019
90,Silver,Brown Claw,Kern River Brewing Co. - The Backyard,Kernville,CA,Brown Porter,2019
91,Bronze,Honey Porter,Cape May Brewing Co. - Rio Grande,Cape May,NJ,Brown Porter,2019
92,Gold,Jalapeno Pineapple Pils,Brickway Brewery & Distillery,Omaha,NE,Chili Beer,2019
93,Silver,Bringin' Da Heat,Devil's Creek Brewery,Collingswood,NJ,Chili Beer,2019
94,Bronze,Oyster Jalapeno Porter,Bull Island Brewing Co.,Hampton,VA,Chili Beer,2019
95,Gold,Old Balltown Bulleit Bourbon Barrel Aged Salted Caramel Dark Chocolate Brownie Milk Stout,PIVO Brewery,Calmar,IA,Chocolate Beer,2019
96,Silver,**Contains Chocolate**,Corporate Ladder Brewing Co.,Palmetto,FL,Chocolate Beer,2019
97,Bronze,Somebody Else's Dream,Fort Myers Brewing Co.,Fort Myers,FL,Chocolate Beer,2019
98,Gold,SeaSide Stout,Pizza Port - Solana Beach,Solana Beach,CA,Classic Irish-Style Dry Stout,2019
99,Silver,Shooter McMunn's,Lost Rhino Brewing Co.,Ashburn,VA,Classic Irish-Style Dry Stout,2019
100,Bronze,O'Dark Thirty,6 Bears & A Goat Brewing Co.,Fredericksburg,VA,Classic Irish-Style Dry Stout,2019
101,Gold,Meadowlark,Metazoa Brewing Co.,Indianapolis,IN,Classic Saison,2019
102,Silver,Summer Opal,Firestone Walker - The Propagator,Marina Del Rey,CA,Classic Saison,2019
103,Bronze,Gray Matter,Aspetuck Brew Lab,Bridgeport,CT,Classic Saison,2019
104,Gold,Duluth Coffee Pale Ale,Earth Rider Brewery,Superior,WI,Coffee Beer,2019
105,Silver,Clear Sky Daybreak,Wolf's Ridge Brewing,Columbus,OH,Coffee Beer,2019
106,Bronze,Central Perk,Ambitious Ales,Long Beach,CA,Coffee Beer,2019
107,Gold,There is No Cow Level,GameCraft Brewing,Laguna Hills,CA,Coffee Stout or Porter,2019
108,Silver,Portola Breakfast Stout,Tustin Brewing Co.,Tustin,CA,Coffee Stout or Porter,2019
109,Bronze,White Russian,SunUp Brewing Co.,Phoenix,AZ,Coffee Stout or Porter,2019
110,Gold,Getting By on Central Time,Sun King Brewery,Indianapolis,IN,Collab,2019
111,Silver,Are You Pricklish?,Taft’s Brewing Co.,Louisville,KY,Collab,2019
112,Bronze,Willie Big Dog,Public Coast Brewing Company,Canon Beach,OR,Collab,2019
113,Gold,Lazy River Pils,New Trail Brewing Co.,Williamsport,PA,Contemporary American-Style Pilsener,2019
114,Silver,Citra Pils,Saint Archer Brewing Co.,San Diego,CA,Contemporary American-Style Pilsener,2019
115,Bronze,Citraveza,Alvarado Street Brewery,Salinas,CA,Contemporary American-Style Pilsener,2019
116,Gold,Cruise to Nowhere,Town Brewing Co.,Charlotte,NC,Contemporary Gose,2019
117,Silver,Mimosa Gose,Pilot Brewing Co.,Charlotte,NC,Contemporary Gose,2019
118,Bronze,Galactic Minotaurt,True Vine Brewing Co.,Tyler,TX,Contemporary Gose,2019
119,Gold,Schnitzengiggles,New England Brewing Co.,Woodbridge,CT,Dortmunder or German-Style Oktoberfest,2019
120,Silver,Lindauer Lager,Wit's End Brewing Co.,Denver,CO,Dortmunder or German-Style Oktoberfest,2019
121,Bronze,Chuckanut Fest Bier,Chuckanut Brewery - South Nut,Burlington,WA,Dortmunder or German-Style Oktoberfest,2019
122,Gold,Station 101,Claremont Craft Ales,Claremont,CA,Double Hoppy Red Ale,2019
123,Silver,Side Hike,Kern River Brewing Co.,Kernville,CA,Double Hoppy Red Ale,2019
124,Bronze,Cannon Ball,Migration Brewing Co. - Glisan,Portland,OR,Double Hoppy Red Ale,2019
125,Gold,Pure Tropics,Parish Brewing Co.,Broussard,LA,Emerging India Pale Ale,2019
126,Silver,Vladimir Brutin,Cannonball Creek Brewing Co.,Golden,CO,Emerging India Pale Ale,2019
127,Gold,Bobcat Brown Ale,Bridger Brewing,Bozeman,MT,English-Style Brown Ale,2019
128,Silver,Eclipse Brown Ale,Equinox Brewing,Fort Collins,CO,English-Style Brown Ale,2019
129,Bronze,Mischievous Brown,Helltown Brewing,Export,PA,English-Style Brown Ale,2019
130,Gold,Hop'lin IPA,Southbound Brewing Co.,Savannah,GA,English-Style India Pale Ale,2019
131,Silver,Shanghai'd IPA,Old Town Brewing,Portland,OR,English-Style India Pale Ale,2019
132,Bronze,Hoppy Poppy,Figueroa Mountain Brewing Co. - Santa Barbara,Santa Barbara,CA,English-Style India Pale Ale,2019
133,Gold,Hold The Reins,Brink Brewing Co.,Cincinnati,OH,English-Style Mild Ale,2019
134,Silver,Sliding Rock,BearWaters Brewing Co.,Canton,NC,English-Style Mild Ale,2019
135,Bronze,Saddle Bronc Brown,Black Tooth Brewing Co.,Sheridan,WY,English-Style Mild Ale,2019
136,Gold,Ferment Pale Ale,Ferment Brewing Co.,Hood River,OR,English-Style or International-Style Pale Ale,2019
137,Silver,Annadel Pale Ale,Third Street AleWorks,Santa Rosa,CA,English-Style or International-Style Pale Ale,2019
138,Bronze,Endless Summer Nights,Cloudburst Brewing,Seattle,WA,English-Style or International-Style Pale Ale,2019
139,Gold,Organic California Blonde Ale,Eel River Brewing Co.,Scotia,CA,English-Style Summer Ale,2019
140,Silver,Quid,Rhinegeist - Innovation Brewery,Cincinnati,OH,English-Style Summer Ale,2019
141,Bronze,Breakside Wentworth by the Sea,Breakside Brewery,Portland,OR,English-Style Summer Ale,2019
142,Gold,Fungus Shui,Meadowlark Brewing,Sidney,MT,Experimental Beer,2019
143,Silver,Shibbleshabble,Primitive Beer,Longmont,CO,Experimental Beer,2019
144,Bronze,Fluffernutter,Kings Brewing Co.,Rancho Cucamonga,CA,Experimental Beer,2019
145,Gold,Correspondent,Wander Brewing,Bellingham,WA,Export Stout,2019
146,Silver,Thor's Shadow Imperial Stout,Odin Brewing Co.,Tukwila,WA,Export Stout,2019
147,Bronze,Void of Light,Gun Hill Brewing Co.,Bronx,NY,Export Stout,2019
148,Gold,ESB,Hillman Beer,Asheville,NC,Extra Special Bitter,2019
149,Silver,Bridgeview,Henderson Brewing Co.,Henderson,KY,Extra Special Bitter,2019
150,Bronze,Red Ale,The Vanguard Brewpub & Distillery,Hampton,VA,Extra Special Bitter,2019
151,Gold,Scoring Discrepancies,Listermann Brewing Co.,Cincinnati,OH,Field Beer,2019
152,Silver,Dessert Station: Cherry Almond Cookie,Corporate Ladder Brewing Co.,Palmetto,FL,Field Beer,2019
153,Bronze,Grandma's Pecan,The Dudes' Brewing Co.,Torrance,CA,Field Beer,2019
154,Gold,Fresh Hop Green Battles,Pinthouse Pizza North,Austin,TX,Fresh Hop Beer,2019
155,Silver,Hop Stalker,Fat Head's Brewery - Canton,Canton,OH,Fresh Hop Beer,2019
156,Bronze,Aqua Seafoam Shame,Cloudburst Brewing,Seattle,WA,Fresh Hop Beer,2019
157,Gold,Bitchin' Berry,Great Basin Brewing Co. - Production Facility,Reno,NV,Fruit Wheat Beer,2019
158,Silver,Cherry Wheat,Sierra Blanca Brewing Co.,Moriarty,NM,Fruit Wheat Beer,2019
159,Bronze,Smash,10 Barrel Brewing Co.,Bend,OR,Fruit Wheat Beer,2019
160,Gold,Roxanne,St. Elmo Brewing Co.,Austin,TX,Fruited American-Style Sour Ale,2019
161,Silver,Hoochie Mama,Storm Peak Brewing Co.,Steamboat Springs,CO,Fruited American-Style Sour Ale,2019
162,Bronze,Sour Blackberry Raspberry,Edmund’s Oast Brewing Co.,Charleston,SC,Fruited American-Style Sour Ale,2019
163,Gold,Midnight Choir,Sun King Brewing,Indianapolis,IN,Fruited Wood- and Barrel-Aged Sour Beer,2019
164,Silver,Crimson Cherry Variant,Upland Brewing Co. - Bloomington Brewpub,Bloomington,IN,Fruited Wood- and Barrel-Aged Sour Beer,2019
165,Bronze,Rossano,Kings Brewing Co.,Rancho Cucamonga,CA,Fruited Wood- and Barrel-Aged Sour Beer,2019
166,Gold,Rhine Heights ALT,Vintage Brewing Co. - Madison,Madison,WI,German-Style Altbier,2019
167,Silver,Howitzer Amber,Red Leg Brewing Co.,Colorado Springs,CO,German-Style Altbier,2019
168,Bronze,Jeremy Altbier,The Royal Oak Brewery,Royal Oak,MI,German-Style Altbier,2019
169,Gold,Pious Monk Dunkel,Church Brew Works - Lawrenceville Brewery,Pittsburgh,PA,German-Style Dark Lager,2019
170,Silver,Black Lager,Bingo Beer Co.,Richmond,VA,German-Style Dark Lager,2019
171,Bronze,Don't Drop That Dun Dun Dunkel,TAPS Brewery & Barrel Room,Tustin,CA,German-Style Dark Lager,2019
172,Gold,Eis Nine,Sun King Brewing - Fishers Small Batch,Fishers,IN,German-Style Doppelbock or Eisbock,2019
173,Silver,Doppelbock,Scorched Earth Brewing Co.,Algonquin,IL,German-Style Doppelbock or Eisbock,2019
174,Bronze,Eis Vienne,Devils Backbone Brewing Co. - Basecamp,Roseland,VA,German-Style Doppelbock or Eisbock,2019
175,Gold,Altstadt Kolsch,Altstadt Brewery,Fredericksburg,TX,German-Style Koelsch,2019
176,Silver,Ice Cutter Kölsch,Joyride Brewing Co.,Edgewater,CO,German-Style Koelsch,2019
177,Bronze,Dry Creek Blonde Ale,Santa Clara Valley Brewing,San Jose,CA,German-Style Koelsch,2019
178,Gold,Oktoberfest,Bear Chase Brewing Co.,Bluemont,VA,German-Style Maerzen,2019
179,Silver,Rocktoberfest,Hutton & Smith Brewing Co.,Chattanooga,TN,German-Style Maerzen,2019
180,Bronze,Festie,Starr Hill Pilot Brewery & Side Stage,Roanoke,VA,German-Style Maerzen,2019
181,Gold,Parliament Drive,Blind Owl Brewery,Indianapolis,IN,German-Style Pilsener,2019
182,Silver,Golden Age Pilsner,Family Business Beer Co.,Dripping Springs,TX,German-Style Pilsener,2019
183,Bronze,Pils,Hardywood West Creek,Richmond,VA,German-Style Pilsener,2019
184,Gold,Meier,Rowley Farmhouse Ales,Santa Fe,NM,German-Style Sour Ale,2019
185,Silver,Meersalz,Narrow Gauge Brewing Co.,Florissant,MO,German-Style Sour Ale,2019
186,Bronze,And the Award Gose to...,Big Dog's Brewing Co.,Las Vegas,NV,German-Style Sour Ale,2019
187,Gold,Krystal Clear,TAPS Brewery & Barrel Room,Tustin,CA,German-Style Wheat Ale,2019
188,Silver,Dunkelweisse,Swashbuckler Brewing Co.,Manheim,PA,German-Style Wheat Ale,2019
189,Bronze,HefeWeizen,Live Oak Brewing Co.,Austin,TX,German-Style Wheat Ale,2019
190,Gold,Boombastic Hazy IPA,Holidaily Brewing Co.,Golden,CO,Gluten-Free Beer,2019
191,Silver,Co-Conspirator Apricot Sour,Revelation Craft Brewing Co.,Rehoboth Beach,DE,Gluten-Free Beer,2019
192,Bronze,Grandpa's Nap,Evasion Brewing - Production Facility,McMinnville,OR,Gluten-Free Beer,2019
193,Gold,1956 Golden Ale,Bootstrap Brewing,Longmont,CO,Golden or Blonde Ale,2019
194,Silver,MadeWest Standard,MadeWest Brewing Co.,Ventura,CA,Golden or Blonde Ale,2019
195,Bronze,Luke's Original,Lucky Luke Brewing Co.,Palmdale,CA,Golden or Blonde Ale,2019
196,Gold,Kveik Thai Tom Kha,Shades Brewing,Park City,UT,Herb and Spice Beer,2019
197,Silver,One Night in Bangkok Smoothie IPA,Midland Brewing Co.,Midland,MI,Herb and Spice Beer,2019
198,Bronze,Deck Daze,Vail Brewing Co. - Vail Village Pilot,Vail,CO,Herb and Spice Beer,2019
199,Silver,Afterburner Smoked Lager,Four Day Ray Brewing,Fishers,IN,Historical Beer,2019
200,Bronze,Decorah Nordic Gruit,PIVO Brewery,Calmar,IA,Historical Beer,2019
201,Gold,A&M Honey Bock,BJ's Restaurant & Brewery - Boulder,Boulder,CO,Honey Beer,2019
202,Silver,Honey Hole,SpindleTap Brewery,Houston,TX,Honey Beer,2019
203,Bronze,Jetty,Great South Bay Brewery,Bay Shore,NY,Honey Beer,2019
204,Gold,Double Cone,Alvarado Street Brewery,Salinas,CA,Imperial India Pale Ale,2019
205,Silver,Westbound Double IPA,Westbound & Down Brewing Co.,Idaho Springs,CO,Imperial India Pale Ale,2019
206,Bronze,Sharrow,Brew Hub,Lakeland,FL,Imperial India Pale Ale,2019
207,Gold,Bone Head Imperial Red,Fat Head's Brewery & Saloon,North Olmsted,OH,Imperial Red Ale,2019
208,Silver,Frogs Like Possum,King's Court Brewing Co.,Poughkeepsie,NY,Imperial Red Ale,2019
209,Bronze,Gifted Gunslinger,Big Sexy Brewing Co.,Sacramento,CA,Imperial Red Ale,2019
210,Gold,The Russian,2SP Brewing Co.,Aston,PA,Imperial Stout,2019
211,Silver,Black Cauldron Imperial Stout,Grand Teton Brewing,Victor,ID,Imperial Stout,2019
212,Bronze,Rescue Buoy Imperial Stout,Rip Current Brewing,San Marcos,CA,Imperial Stout,2019
213,Gold,Timbo Pils,Highland Park Brewery - Chinatown,Los Angeles,CA,India Pale Lager or Malt Liquor,2019
214,Silver,Go Kart Mozart,MotoSonora Brewing Co.,Tucson,AZ,India Pale Lager or Malt Liquor,2019
215,Bronze,Yeah Buoy IPL,Logboat Brewing Co.,Columbia,MO,India Pale Lager or Malt Liquor,2019
216,Gold,Dark Horse,Snake River Brewing Co.,Jackson,WY,International-Style Dark Lager,2019
217,Silver,El Corn,The Post Brewing Co.,Lafayette,CO,International-Style Dark Lager,2019
218,Bronze,Schwarzbier,Hofbräuhaus Cleveland,Cleveland,OH,International-Style Dark Lager,2019
219,Gold,Torcido,Barebottle Brewing Co.,San Francisco,CA,International-Style Pilsener,2019
220,Silver,Upslope Craft Lager,Upslope Brewing Co. - Flatiron Park,Boulder,CO,International-Style Pilsener,2019
221,Bronze,Party,MAP Brewing Co.,Bozeman,MT,International-Style Pilsener,2019
222,Gold,Outraged Daughters,Wise Man Brewing,Winston-Salem,NC,Irish-Style Red Ale,2019
223,Silver,Balefire Irish Red,Mirror Image Brewing Co.,Frederick,CO,Irish-Style Red Ale,2019
224,Bronze,Red Molly Irish Red Ale,Pale Fire Brewing Co.,Harrisonburg,VA,Irish-Style Red Ale,2019
225,Gold,Extra Extra Juicy Bits,WeldWerks Brewing Co.,Greeley,CO,Juicy or Hazy Imperial India Pale Ale,2019
226,Silver,Juice Jockey,Phantom Ales,Anaheim,CA,Juicy or Hazy Imperial India Pale Ale,2019
227,Bronze,Chaos Emeralds,Lone Pine Brewing Company - Gorham,Gorham,ME,Juicy or Hazy Imperial India Pale Ale,2019
228,Gold,Beezer,Old Irving Brewing Co.,Chicago,IL,Juicy or Hazy India Pale Ale,2019
229,Silver,Hazy IPA,City Lights Brewing Co.,Milwaukee,WI,Juicy or Hazy India Pale Ale,2019
230,Bronze,Devil's Gulch,Pond Farm Brewing Co.,San Rafael,CA,Juicy or Hazy India Pale Ale,2019
231,Gold,Gulp,Tribus Beer Co.,Milford,CT,Juicy or Hazy Pale Ale,2019
232,Silver,Itsy Bits,WeldWerks Brewing Co.,Greeley,CO,Juicy or Hazy Pale Ale,2019
233,Bronze,Mo-Haze-Ic,Migration Brewing Co. - Wilkes,Portland,OR,Juicy or Hazy Pale Ale,2019
234,Gold,Breakside What Rough Beast,Breakside Brewery - NW Slabtown,Portland,OR,Juicy or Hazy Strong Pale Ale,2019
235,Silver,Kaaterskill,West Kill Brewing,West Kill,NY,Juicy or Hazy Strong Pale Ale,2019
236,Bronze,Goofy Boots,Penrose Brewing Co.,Geneva,IL,Juicy or Hazy Strong Pale Ale,2019
237,Gold,German Pilsner,Port City Brewing Co.,Alexandria,VA,Kellerbier or Zwickelbier,2019
238,Silver,Loral Zwickelbier,Haas Innovations Brewing,Yakima,WA,Kellerbier or Zwickelbier,2019
239,Bronze,Stand By,Rockwell Beer Co.,St. Louis,MO,Kellerbier or Zwickelbier,2019
240,Gold,Altitude Banquet,Altitude Chophouse and Brewery,Laramie,WY,Light Lager,2019
241,Silver,Sif's Light Lager,Odin Brewing Co.,Tukwila,WA,Light Lager,2019
242,Bronze,Lightner Creek Lager,Carver Brewing Co.,Durango,CO,Light Lager,2019
243,Gold,Standard Issue,Central Standard Brewing,Wichita,KS,Mixed-Culture Brett Beer,2019
244,Silver,Farmer's Reserve No. 5,Almanac Beer Co.,Alameda,CA,Mixed-Culture Brett Beer,2019
245,Bronze,Côte d'Or - Double Cerise,Rowley Farmhouse Ales,Santa Fe,NM,Mixed-Culture Brett Beer,2019
246,Gold,Altstadt Lager,Altstadt Brewery,Fredericksburg,TX,Munich-Style Helles,2019
247,Silver,Florida Sunshine,Crooked Can Brewing Co.,Winter Garden,FL,Munich-Style Helles,2019
248,Bronze,Wayfinder Hell,Wayfinder Beer,Portland,OR,Munich-Style Helles,2019
249,Gold,Enough Said N/A,Two Roots Brewing Co.,San Diego,CA,Non-Alcohol Beer or Alcohol-Free Beer,2019
250,Silver,Bravus Oatmeal Stout,Bravus Brewing Co.,Newport Beach,CA,Non-Alcohol Beer or Alcohol-Free Beer,2019
251,Bronze,Bravus Barrel-Aged Bourbon Stout,Bravus Brewing Co.,Newport Beach,CA,Non-Alcohol Beer or Alcohol-Free Beer,2019
252,Gold,80 Chain Stout,MAP Brewing Co.,Bozeman,MT,Oatmeal Stout,2019
253,Silver,Yonder Mountain Stout,Vine Street Pub & Brewery,Denver,CO,Oatmeal Stout,2019
254,Bronze,Shaman Stout,Toltec Brewing Co.,Albuquerque,NM,Oatmeal Stout,2019
255,Gold,Private Stock Ale,AleSmith Brewing Co.,San Diego,CA,Old Ale or Strong Ale,2019
256,Silver,Old Scrooge,Silver City Brewery,Bremerton,WA,Old Ale or Strong Ale,2019
257,Bronze,Last Will and Testament,Monday Night Brewing - Garage,Atlanta,GA,Old Ale or Strong Ale,2019
258,Gold,Chronic Amber Ale,Pizza Port - Bressi Ranch,Carlsbad,CA,Ordinary or Special Bitter,2019
259,Silver,Cousin Jack,Dostal Alley Brewpub & Casino,Central City,CO,Ordinary or Special Bitter,2019
260,Bronze,Milford Pub Ale,River's Edge Brewing Co.,Milford,MI,Ordinary or Special Bitter,2019
261,Gold,"Very, Very Far",Off Color Brewing,Chicago,IL,Other Belgian-Style Ale,2019
262,Silver,Conquer Then Divide,Barrage Brewing Co.,Farmingdale,NY,Other Belgian-Style Ale,2019
263,Bronze,Pentuple,Hoppin' Frog Brewing,Akron,OH,Other Belgian-Style Ale,2019
264,Gold,Northstar Imperial Porter,Twisted Pine Brewing Co.,Boulder,CO,Other Strong Beer,2019
265,Silver,False Hope,Spilled Grain Brewhouse,Annandale,MN,Other Strong Beer,2019
266,Bronze,Double Brown Ale,Tumbleroot Brewery and Distillery,Santa Fe,NM,Other Strong Beer,2019
267,Gold,Distemper,IMBIB Custom Brews,Reno,NV,Proam,2019
268,Silver,Leicht,Precarious Beer Project – Beer Hall,Williamsburg,VA,Proam,2019
269,Bronze,Chess with Checkers,New Belgium Brewing Co.,Fort Collins,CO,Proam,2019
270,Gold,Whole Hog Pumpkin Ale,Stevens Point Brewery,Stevens Point,WI,Pumpkin/Squash Beer or Pumpkin Spice Beer,2019
271,Silver,Pumpkin Rumble,Mistress Brewing Co.,Ankeny,IA,Pumpkin/Squash Beer or Pumpkin Spice Beer,2019
272,Bronze,Pumpkinator,Saint Arnold Brewing Co.,Houston,TX,Pumpkin/Squash Beer or Pumpkin Spice Beer,2019
273,Gold,Tabula Rasa,Second Chance Beer Co.,San Diego,CA,Robust Porter,2019
274,Silver,Powell Street Porter,Bartlett Hall,San Francisco,CA,Robust Porter,2019
275,Bronze,Shadowcaster Porter,Folklore Brewing & Meadery,Dothan,AL,Robust Porter,2019
276,Gold,Rye Dawn,Breakwater Brewing Co.,Oceanside,CA,Rye Beer,2019
277,Silver,Unite the Clans,Third Space Brewing,Milwaukee,WI,Rye Beer,2019
278,Bronze,Suss it Out,Level Crossing Brewing Co.,South Salt Lake,UT,Rye Beer,2019
279,Gold,Knuckle Dragger,Dueces Wild Brewery,Colorado Springs,CO,Scotch Ale,2019
280,Silver,Real Heavy,Real Ale Brewing Co.,Blanco,TX,Scotch Ale,2019
281,Bronze,Wee Heavy Metal,Hutton & Smith Brewing Co. - M. L. King,Chattanooga,TN,Scotch Ale,2019
282,Gold,Taildragger Clan-Destine,Saddle Mountain Brewing Co.,Goodyear,AZ,Scottish-Style Ale,2019
283,Silver,Yarmouth,Arkane Aleworks,Largo,FL,Scottish-Style Ale,2019
284,Bronze,Thistle Dew,Ursa Minor Brewing,Duluth,MN,Scottish-Style Ale,2019
285,Gold,Texas Lager,Community Beer Co.,Dallas,TX,Session Beer,2019
286,Silver,Lite It!,Light the Lamp Brewery,Grayslake,IL,Session Beer,2019
